{
  "name": "Standing Wave 2D (linear wave theory benchmark)",
  "fluid_type": "Water",
  "geometry_file": "../geometries/null-obstacle.stl",
  "domain": {
    "min": [0.0, 0.0, 0.0],
    "max": [0.10, 0.05, 0.0005]
  },
  "boundary_conditions": {
    "x_min": "Periodic",
    "x_max": "Periodic",
    "y_min": "Wall",
    "y_max": "Outflow",
    "z_min": "Wall",
    "z_max": "Wall"
  },
  "particle_spacing": 0.0005,
  "gravity": [0.0, -9.81, 0.0],
  "speed_of_sound": 20.0,
  "viscosity": 0.001,
  "initial_temperature": 293.15,
  "cfl_number": 0.4,
  "solver": "wcsph"
}
